{
  "thresholds": "example_value",
  "notify_no_data": true,
  "no_data_timeframe": 42,
  "require_full_window": true,
  "notify_audit": true,
  "renotify_interval": 42,
  "renotify_statuses": [
    "warn"
  ],
  "escalation_message": "CPU usage is high on {{host.name}}",
  "timeout_h": 42,
  "evaluation_delay": 42
}